{
    "schema_version": 1,
    "status": "valid",
    "valid": true,
    "complete": true,
    "findings": [],
    "modules": [
        {
            "id": "audit",
            "class": "SillbeamFixturedc5df0b18b11\\Module\\Audit\\AuditModule",
            "scope": "shared",
            "project": null,
            "enabled": true,
            "active": true,
            "inactive_reason": null,
            "directory": "/tmp/sillbeam-source-117922df565b/src/Module/Audit",
            "descriptor": "/tmp/sillbeam-source-117922df565b/src/Module/Audit/AuditModule.php",
            "declared_dependencies": [
                "SillbeamFixturedc5df0b18b11\\Module\\Payments\\PaymentsModule",
                "SillbeamFixturedc5df0b18b11\\Module\\Shipping\\ShippingModule",
                "SillbeamFixturedc5df0b18b11\\Module\\Notifications\\NotificationsModule"
            ],
            "observed_dependencies": [
                "SillbeamFixturedc5df0b18b11\\Module\\Notifications\\NotificationsModule"
            ],
            "references": [
                {
                    "module": "SillbeamFixturedc5df0b18b11\\Module\\Notifications\\NotificationsModule",
                    "class": "SillbeamFixturedc5df0b18b11\\Module\\Notifications\\Port",
                    "file": "/tmp/sillbeam-source-117922df565b/src/Module/Audit/Consumer.php",
                    "line": 1
                }
            ],
            "activation_reasons": [
                "project:admin:declared",
                "project:shop:declared"
            ],
            "controllers": [],
            "entities": []
        },
        {
            "id": "billing",
            "class": "SillbeamFixturedc5df0b18b11\\Module\\Billing\\BillingModule",
            "scope": "shared",
            "project": null,
            "enabled": true,
            "active": true,
            "inactive_reason": null,
            "directory": "/tmp/sillbeam-source-117922df565b/src/Module/Billing",
            "descriptor": "/tmp/sillbeam-source-117922df565b/src/Module/Billing/BillingModule.php",
            "declared_dependencies": [
                "SillbeamFixturedc5df0b18b11\\Module\\Pricing\\PricingModule",
                "SillbeamFixturedc5df0b18b11\\Module\\Cart\\CartModule",
                "SillbeamFixturedc5df0b18b11\\Module\\Orders\\OrdersModule"
            ],
            "observed_dependencies": [
                "SillbeamFixturedc5df0b18b11\\Module\\Orders\\OrdersModule"
            ],
            "references": [
                {
                    "module": "SillbeamFixturedc5df0b18b11\\Module\\Orders\\OrdersModule",
                    "class": "SillbeamFixturedc5df0b18b11\\Module\\Orders\\Port",
                    "file": "/tmp/sillbeam-source-117922df565b/src/Module/Billing/Consumer.php",
                    "line": 1
                }
            ],
            "activation_reasons": [
                "project:admin:declared",
                "project:shop:declared",
                "dependency:SillbeamFixturedc5df0b18b11\\Module\\Payments\\PaymentsModule",
                "dependency:SillbeamFixturedc5df0b18b11\\Module\\Shipping\\ShippingModule",
                "dependency:SillbeamFixturedc5df0b18b11\\Module\\Notifications\\NotificationsModule"
            ],
            "controllers": [],
            "entities": []
        },
        {
            "id": "cart",
            "class": "SillbeamFixturedc5df0b18b11\\Module\\Cart\\CartModule",
            "scope": "shared",
            "project": null,
            "enabled": true,
            "active": true,
            "inactive_reason": null,
            "directory": "/tmp/sillbeam-source-117922df565b/src/Module/Cart",
            "descriptor": "/tmp/sillbeam-source-117922df565b/src/Module/Cart/CartModule.php",
            "declared_dependencies": [
                "SillbeamFixturedc5df0b18b11\\Module\\Catalog\\CatalogModule",
                "SillbeamFixturedc5df0b18b11\\Module\\Stock\\StockModule",
                "SillbeamFixturedc5df0b18b11\\Module\\Pricing\\PricingModule"
            ],
            "observed_dependencies": [
                "SillbeamFixturedc5df0b18b11\\Module\\Pricing\\PricingModule"
            ],
            "references": [
                {
                    "module": "SillbeamFixturedc5df0b18b11\\Module\\Pricing\\PricingModule",
                    "class": "SillbeamFixturedc5df0b18b11\\Module\\Pricing\\Port",
                    "file": "/tmp/sillbeam-source-117922df565b/src/Module/Cart/Consumer.php",
                    "line": 1
                }
            ],
            "activation_reasons": [
                "project:admin:declared",
                "project:shop:declared",
                "dependency:SillbeamFixturedc5df0b18b11\\Module\\Orders\\OrdersModule",
                "dependency:SillbeamFixturedc5df0b18b11\\Module\\Billing\\BillingModule",
                "dependency:SillbeamFixturedc5df0b18b11\\Module\\Payments\\PaymentsModule"
            ],
            "controllers": [],
            "entities": []
        },
        {
            "id": "catalog",
            "class": "SillbeamFixturedc5df0b18b11\\Module\\Catalog\\CatalogModule",
            "scope": "shared",
            "project": null,
            "enabled": true,
            "active": true,
            "inactive_reason": null,
            "directory": "/tmp/sillbeam-source-117922df565b/src/Module/Catalog",
            "descriptor": "/tmp/sillbeam-source-117922df565b/src/Module/Catalog/CatalogModule.php",
            "declared_dependencies": [
                "SillbeamFixturedc5df0b18b11\\Module\\User\\UserModule",
                "SillbeamFixturedc5df0b18b11\\Module\\Identity\\IdentityModule"
            ],
            "observed_dependencies": [
                "SillbeamFixturedc5df0b18b11\\Module\\Identity\\IdentityModule"
            ],
            "references": [
                {
                    "module": "SillbeamFixturedc5df0b18b11\\Module\\Identity\\IdentityModule",
                    "class": "SillbeamFixturedc5df0b18b11\\Module\\Identity\\Port",
                    "file": "/tmp/sillbeam-source-117922df565b/src/Module/Catalog/Consumer.php",
                    "line": 1
                }
            ],
            "activation_reasons": [
                "project:admin:declared",
                "project:shop:declared",
                "dependency:SillbeamFixturedc5df0b18b11\\Module\\Stock\\StockModule",
                "dependency:SillbeamFixturedc5df0b18b11\\Module\\Pricing\\PricingModule",
                "dependency:SillbeamFixturedc5df0b18b11\\Module\\Cart\\CartModule"
            ],
            "controllers": [],
            "entities": []
        },
        {
            "id": "identity",
            "class": "SillbeamFixturedc5df0b18b11\\Module\\Identity\\IdentityModule",
            "scope": "shared",
            "project": null,
            "enabled": true,
            "active": true,
            "inactive_reason": null,
            "directory": "/tmp/sillbeam-source-117922df565b/src/Module/Identity",
            "descriptor": "/tmp/sillbeam-source-117922df565b/src/Module/Identity/IdentityModule.php",
            "declared_dependencies": [
                "SillbeamFixturedc5df0b18b11\\Module\\User\\UserModule"
            ],
            "observed_dependencies": [
                "SillbeamFixturedc5df0b18b11\\Module\\User\\UserModule"
            ],
            "references": [
                {
                    "module": "SillbeamFixturedc5df0b18b11\\Module\\User\\UserModule",
                    "class": "SillbeamFixturedc5df0b18b11\\Module\\User\\Port",
                    "file": "/tmp/sillbeam-source-117922df565b/src/Module/Identity/Consumer.php",
                    "line": 1
                }
            ],
            "activation_reasons": [
                "project:admin:declared",
                "project:shop:declared",
                "dependency:SillbeamFixturedc5df0b18b11\\Module\\Catalog\\CatalogModule",
                "dependency:SillbeamFixturedc5df0b18b11\\Module\\Stock\\StockModule",
                "dependency:SillbeamFixturedc5df0b18b11\\Module\\Pricing\\PricingModule"
            ],
            "controllers": [],
            "entities": []
        },
        {
            "id": "notifications",
            "class": "SillbeamFixturedc5df0b18b11\\Module\\Notifications\\NotificationsModule",
            "scope": "shared",
            "project": null,
            "enabled": true,
            "active": true,
            "inactive_reason": null,
            "directory": "/tmp/sillbeam-source-117922df565b/src/Module/Notifications",
            "descriptor": "/tmp/sillbeam-source-117922df565b/src/Module/Notifications/NotificationsModule.php",
            "declared_dependencies": [
                "SillbeamFixturedc5df0b18b11\\Module\\Billing\\BillingModule",
                "SillbeamFixturedc5df0b18b11\\Module\\Payments\\PaymentsModule",
                "SillbeamFixturedc5df0b18b11\\Module\\Shipping\\ShippingModule"
            ],
            "observed_dependencies": [
                "SillbeamFixturedc5df0b18b11\\Module\\Shipping\\ShippingModule"
            ],
            "references": [
                {
                    "module": "SillbeamFixturedc5df0b18b11\\Module\\Shipping\\ShippingModule",
                    "class": "SillbeamFixturedc5df0b18b11\\Module\\Shipping\\Port",
                    "file": "/tmp/sillbeam-source-117922df565b/src/Module/Notifications/Consumer.php",
                    "line": 1
                }
            ],
            "activation_reasons": [
                "project:admin:declared",
                "project:shop:declared",
                "dependency:SillbeamFixturedc5df0b18b11\\Module\\Audit\\AuditModule"
            ],
            "controllers": [],
            "entities": []
        },
        {
            "id": "orders",
            "class": "SillbeamFixturedc5df0b18b11\\Module\\Orders\\OrdersModule",